question,votes,tags
What does the “yield” keyword do?,"10296
votes",python iterator generator yield coroutine
What does if __name__ == “__main__”: do?,"6135
votes",python namespaces main python-module idioms
Does Python have a ternary conditional operator?,"6115
votes",python operators ternary-operator conditional-operator
What are metaclasses in Python?,"5755
votes",python oop metaclass python-datamodel
How do I check whether a file exists without exceptions?,"5660
votes",python file file-exists
Calling an external command from Python,"4934
votes",python shell terminal subprocess command
How do I merge two dictionaries in a single expression in Python?,"4879
votes",python dictionary merge
How can I safely create a nested directory?,"4293
votes",python exception path directory operating-system
Accessing the index in 'for' loops?,"3652
votes",python loops list
Difference between staticmethod and classmethod,"3622
votes",python oop methods python-decorators
Does Python have a string 'contains' substring method?,"3599
votes",python string substring contains
How do I list all files of a directory?,"3472
votes",python directory
How to make a flat list out of list of lists?,"3451
votes",python list multidimensional-array flatten
How do I sort a dictionary by value?,"3422
votes",python sorting dictionary
Understanding slice notation,"3345
votes",python list slice iterable
Finding the index of an item in a list,"3236
votes",python list indexing
How do I check if a list is empty?,"3234
votes",python list
Iterating over dictionaries using 'for' loops,"3180
votes",python python-2.7 dictionary
Using global variables in a function,"3144
votes",python global-variables scope
What is the difference between Python's list methods append and extend?,"3116
votes",python list data-structures append extend
How to get the current time in Python,"2939
votes",python datetime time
Catch multiple exceptions in one line (except block),"2790
votes",python exception exception-handling
How to make a chain of function decorators?,"2766
votes",python decorator python-decorators
How can I make a time delay in Python? [duplicate],"2766
votes",python delay sleep timedelay
Difference between __str__ and __repr__?,"2755
votes",python magic-methods repr
Check if a given key already exists in a dictionary,"2683
votes",python dictionary
How can I add new keys to a dictionary?,"2659
votes",python dictionary lookup
How do I pass a variable by reference?,"2658
votes",python reference parameter-passing pass-by-reference
“Least Astonishment” and the Mutable Default Argument,"2614
votes",python language-design default-parameters least-astonishment
List changes unexpectedly after assignment. How do I clone or copy it to prevent this?,"2592
votes",python list copy clone
How do I concatenate two lists in Python?,"2575
votes",python list concatenation
Understanding Python super() with __init__() methods [duplicate],"2555
votes",python class oop inheritance super
How to install pip on Windows?,"2549
votes",python windows installation pip easy-install
How do I copy a file in Python?,"2536
votes",python file copy filesystems file-copying
What does ** (double star/asterisk) and * (star/asterisk) do for parameters?,"2387
votes",python syntax parameter-passing variadic-functions argument-unpacking
What is __init__.py for?,"2375
votes",python module package python-packaging
Convert bytes to a string,"2374
votes",python string python-3.x
Manually raising (throwing) an exception in Python,"2305
votes",python exception
How do you split a list into evenly sized chunks?,"2303
votes",python list split chunks
How do I parse a string to a float or int?,"2271
votes",python parsing floating-point type-conversion integer
Find current directory and file's directory [duplicate],"2245
votes",python directory
Converting string into datetime,"2204
votes",python datetime
How to delete a file or folder?,"2182
votes",python file-io directory delete-file
How do I get a substring of a string in Python?,"2173
votes",python string substring
How to print colored text in Python?,"2168
votes",python terminal output ansi-colors
Why is “1000000000000000 in range(1000000000000001)” so fast in Python 3?,"2157
votes",python performance python-3.x range python-internals
How to access environment variable values?,"2151
votes",python environment-variables
How do you change the size of figures drawn with matplotlib?,"2096
votes",python graph matplotlib plot visualization
Getting the last element of a list,"2093
votes",python list indexing
Is there a way to run Python on Android?,"2092
votes",android python jython ase android-scripting
How do I lowercase a string in Python?,"2081
votes",python string uppercase lowercase
How to upgrade all Python packages with pip?,"2071
votes",python pip
How to iterate over rows in a DataFrame in Pandas,"2035
votes",python pandas rows dataframe
How to read a file line-by-line into a list?,"2027
votes",python string file readlines
How to select rows from a DataFrame based on column values?,"2015
votes",python pandas dataframe
Are static class variables possible in Python?,"1963
votes",python class oop static class-variables
How do I get the number of elements in a list?,"1951
votes",python list
How do I sort a list of dictionaries by a value of the dictionary?,"1925
votes",python list sorting dictionary data-structures
How to print without newline or space?,"1882
votes",python newline
Renaming columns in pandas,"1864
votes",python pandas replace dataframe rename
Why is reading lines from stdin much slower in C++ than Python?,"1864
votes",python c++ benchmarking iostream getline
How to remove a key from a Python dictionary?,"1812
votes",python dictionary data-structures unset
Determine the type of an object?,"1795
votes",python dictionary types typeof
How to randomly select an item from a list?,"1780
votes",python list random
Why is it string.join(list) instead of list.join(string)?,"1768
votes",python string list
Calling a function of a module by using its name (a string),"1757
votes",python object
Static methods in Python?,"1732
votes",python static-methods
Replacements for switch statement in Python?,"1718
votes",python switch-statement
Limiting floats to two decimal points,"1703
votes",python floating-point rounding precision
How can I remove a trailing newline?,"1699
votes",python newline trailing
How do I install pip on macOS or OS X?,"1675
votes",python macos pip installation
How to know if an object has an attribute in Python,"1653
votes",python attributes
How to leave/exit/deactivate a Python virtualenv,"1629
votes",python virtualenv virtualenvwrapper
How do I check if a string is a number (float)?,"1622
votes",python casting floating-point type-conversion
Meaning of @classmethod and @staticmethod for beginner? [duplicate],"1607
votes",python oop static-methods class-method
How to determine a Python variable's type?,"1594
votes",python types unsigned signed 16-bit
How do you append to a file in Python?,"1592
votes",python file append
How can I count the occurrences of a list item?,"1544
votes",python list count
How can I print literal curly-brace characters in python string and also use .format on it?,"1541
votes",python string format string-formatting curly-braces
How to remove an element from a list by index,"1527
votes",python list
How do you read from stdin?,"1481
votes",python stdin
How to pad zeroes to a string?,"1466
votes",python string zero-padding
Getting the class name of an instance?,"1452
votes",python introspection instanceof python-datamodel
Why can't Python parse this JSON data?,"1443
votes",python json parsing
Importing files from different folder,"1442
votes",python importerror python-import
How to check if the string is empty?,"1434
votes",python string comparison-operators
Delete an element from a dictionary,"1432
votes",python dictionary del
Use of *args and **kwargs [duplicate],"1423
votes",python args kwargs
Hidden features of Python [closed],"1418
votes",python hidden-features
Delete column from pandas DataFrame,"1375
votes",python pandas dataframe
Converting integer to string?,"1370
votes",python string integer
Generate random integers between 0 and 9,"1362
votes",python random integer
How to print to stderr in Python?,"1358
votes",python printing stderr zen-of-python
Reverse a string in Python,"1354
votes",python string
String formatting: % vs. .format,"1350
votes",python performance logging string-formatting f-string
Random string generation with upper case letters and digits,"1349
votes",python string random
Installing specific package versions with pip,"1339
votes",python mysql pip pypi mysql-python
Extracting extension from filename in Python,"1323
votes",python filenames file-extension
Pythonic way to create a long multi-line string,"1322
votes",python string multiline multilinestring
UnicodeEncodeError: 'ascii' codec can't encode character u'\xa0' in position 20: ordinal not in range(128),"1309
votes",python unicode beautifulsoup python-2.x python-unicode
What is the meaning of single and double underscore before an object name?,"1309
votes",python oop naming-conventions
Proper way to declare custom exceptions in modern Python?,"1308
votes",python exception custom-exceptions
What's the canonical way to check for type in Python?,"1295
votes",python types
How can you profile a Python script?,"1293
votes",python performance profiling time-complexity
How can I use threading in Python?,"1290
votes",python multithreading concurrency python-multithreading
Create a dictionary with list comprehension,"1289
votes",python dictionary list-comprehension dictionary-comprehension
Python class inherits object,"1264
votes",python class oop object inheritance
What is the Python 3 equivalent of “python -m SimpleHTTPServer”,"1261
votes",python python-3.x httpserver simplehttpserver
What are the differences between type() and isinstance()?,"1260
votes",python oop inheritance types
Convert two lists into a dictionary,"1258
votes",python list dictionary
How to flush output of print function?,"1232
votes",python python-3.x printing flush
How to measure elapsed time in Python?,"1231
votes",python performance measure timeit
fatal error: Python.h: No such file or directory,"1224
votes",python gcc python-c-api
How do I check what version of Python is running my script?,"1204
votes",python version
Referring to the null object in Python,"1202
votes",python null
Save plot to image file instead of displaying it using Matplotlib,"1174
votes",python matplotlib plot
How do I connect to a MySQL Database in Python?,"1169
votes",python mysql
How to import a module given the full path?,"1168
votes",python configuration python-import python-module
How do I trim whitespace from a string?,"1167
votes",python string trim
Is there a way to create multiline comments in Python?,"1164
votes",python comments documentation
Why does comparing strings using either '==' or 'is' sometimes produce a different result?,"1156
votes",python string comparison identity equality
How do I write JSON data to a file?,"1152
votes",python json
How to find if directory exists in Python,"1152
votes",python directory
How can I represent an 'Enum' in Python?,"1143
votes",python python-3.x enums
What is the purpose of the word 'self'?,"1139
votes",python class oop self
Does Django scale? [closed],"1139
votes",python django web-applications scalability
Use different Python version with virtualenv,"1135
votes",python virtualenv virtualenvwrapper
Selecting multiple columns in a pandas dataframe,"1131
votes",python pandas dataframe select
How to install packages using pip according to the requirements.txt file from a local directory?,"1105
votes",python virtualenv pip
How to terminate a Python script,"1104
votes",python termination
"If Python is interpreted, what are .pyc files?","1096
votes",python compiled interpreted-language pyc
"In Python, how do I determine if an object is iterable?","1096
votes",python iterable
How to prettyprint a JSON file?,"1087
votes",python json formatting pretty-print
Correct way to write line to file?,"1082
votes",python file-io
How can I do a line break (line continuation) in Python?,"1079
votes",python syntax line-breaks long-lines
How do I return multiple values from a function? [closed],"1078
votes",python coding-style return return-value
How do I trim whitespace?,"1076
votes",python string whitespace trim strip
Why do people write the #!/usr/bin/env python shebang on the first line of a Python script?,"1058
votes",python shell shebang
"What is the difference between venv, pyvenv, pyenv, virtualenv, virtualenvwrapper, pipenv, etc?","1055
votes",python virtualenv virtualenvwrapper pyenv python-venv
How to get the ASCII value of a character,"1049
votes",python ascii
How can I reverse a list in Python?,"1045
votes",python list
Find all files in a directory with extension .txt in Python,"1043
votes",python file-io
Get list from pandas DataFrame column headers,"1027
votes",python pandas dataframe
What's the difference between lists and tuples?,"1027
votes",python list tuples
How to get line count of a large file cheaply in Python?,"1027
votes",python text-files line-count
What IDE to use for Python? [closed],"1027
votes",python ide editor
How to get the filename without the extension from a path in Python?,"1025
votes",python string path
How do I parse XML in Python?,"1017
votes",python xml
What is setup.py?,"1017
votes",python python-3.x setup.py pypi python-packaging
Removing duplicates in lists,"1015
votes",python algorithm list duplicates intersection
How to put the legend out of the plot,"1010
votes",python matplotlib legend
How do I create a constant in Python?,"1010
votes",python constants
How can I check for NaN values?,"1009
votes",python math
How can I get a list of locally installed Python modules?,"1004
votes",python module pip
How do I get time of a Python program's execution?,"1002
votes",python time execution-time
Adding new column to existing DataFrame in Python pandas,"1001
votes",python pandas dataframe chained-assignment
What is the difference between old style and new style classes in Python?,"1001
votes",python class oop types new-style-class
Can someone explain __all__ in Python?,"994
votes",python syntax namespaces
How does the @property decorator work?,"992
votes",python properties decorator python-decorators python-internals
“Large data” work flows using pandas,"990
votes",python mongodb pandas hdf5 large-data
What is the use of “assert” in Python?,"975
votes",python assert assertions
How do I check if a variable exists?,"973
votes",python exception variables
How to read a text file into a string variable and strip newlines?,"969
votes",python string
Is there a built-in function to print all the current properties and values of an object?,"968
votes",python debugging introspection pretty-print python-datamodel
How do I get the row count of a pandas DataFrame?,"967
votes",python pandas dataframe
Creating a singleton in Python,"965
votes",python singleton decorator base-class metaclass
"What is a mixin, and why are they useful?","963
votes",python oop multiple-inheritance mixins
Count the number occurrences of a character in a string,"961
votes",python string count
How can I sort a dictionary by key?,"958
votes",python sorting dictionary
How do I find the location of my Python site-packages directory?,"956
votes",python installation
Is there a simple way to delete a list element by value?,"953
votes",python list
How to get file creation & modification date/times in Python?,"949
votes",python file
"Difference between del, remove and pop on lists","948
votes",python list
Why use pip over easy_install? [closed],"936
votes",python pip setuptools easy-install pypi
How to remove items from a list while iterating?,"934
votes",python iteration
Why are Python lambdas useful? [closed],"929
votes",python function lambda closures
Display number with leading zeros,"927
votes",python integer string-formatting
Should I use 'has_key()' or 'in' on Python dicts?,"925
votes",python dictionary
if/else in a list comprehension,"925
votes",python list-comprehension
Running shell command and capturing the output,"923
votes",python shell subprocess
How to move a file?,"921
votes",python file file-handling
"differentiate null=True, blank=True in django","917
votes",python django django-models
What are “named tuples” in Python?,"915
votes",python tuples namedtuple
Checking whether a variable is an integer or not [duplicate],"914
votes",python
Putting a simple if-then-else statement on one line [duplicate],"913
votes",python if-statement syntax ternary-operator
What is the standard Python docstring format? [closed],"902
votes",python coding-style documentation docstring
How to change the order of DataFrame columns?,"901
votes",python pandas dataframe
Add one row to pandas DataFrame,"901
votes",python pandas dataframe append
How does Python's super() work with multiple inheritance?,"900
votes",python multiple-inheritance
Getting key with maximum value in dictionary?,"887
votes",python dictionary max
How do I install a Python package with a .whl file?,"887
votes",python pip python-wheel downloadfile jpype
Best way to convert string to bytes in Python 3?,"885
votes",python string character-encoding python-3.x
How do I download a file over HTTP using Python?,"884
votes",python http urllib
How to iterate through two lists in parallel?,"882
votes",python list for-loop iterator
Peak detection in a 2D array,"877
votes",python image-processing
How to copy a dictionary and only edit the copy,"872
votes",python python-3.x dictionary reference
list comprehension vs. lambda + filter,"867
votes",python list functional-programming filter lambda
How do I remove/delete a folder that is not empty?,"859
votes",python file
How to get the home directory in Python?,"856
votes",python cross-platform home-directory
error: Unable to find vcvarsall.bat,"852
votes",python windows pip setup.py failed-installation
"Should I put #! (shebang) in Python scripts, and what form should it take?","850
votes",python shell python-3.x shebang
What does the 'b' character do in front of a string literal?,"850
votes",python string unicode binary
How to make a class JSON serializable,"847
votes",python json serialization
Converting unix timestamp string to readable date,"841
votes",python datetime unix-timestamp strftime
Why does Python code run faster in a function?,"840
votes",python performance profiling benchmarking cpython
Python's equivalent of && (logical-and) in an if-statement,"838
votes",python if-statement keyword logical-operators and-operator
How to make IPython notebook matplotlib plot inline,"836
votes",python matplotlib jupyter-notebook ipython data-visualization
Fastest way to check if a value exists in a list,"832
votes",python performance list
pip install mysql-python fails with EnvironmentError: mysql_config not found,"830
votes",python pip mysql-python
How do I get the full path of the current file's directory?,"828
votes",python directory
Change data type of columns in Pandas,"827
votes",python pandas dataframe types casting
Get difference between two lists,"822
votes",python performance list set set-difference
Multiprocessing vs Threading Python [duplicate],"822
votes",python multithreading multiprocessing
mkdir -p functionality in Python [duplicate],"820
votes",python mkdir
How to sort a list of objects based on an attribute of the objects?,"814
votes",python list sorting oop count
Emulate a do-while loop in Python?,"814
votes",python while-loop do-while
"Extract file name from path, no matter what the os/path format","813
votes",python
Python integer incrementing with ++ [duplicate],"812
votes",python syntax increment
How to import other Python files?,"809
votes",python python-import
How to return dictionary keys as a list in Python?,"809
votes",python python-3.x list dictionary python-2.x
Behaviour of increment and decrement operators in Python,"808
votes",python operators increment decrement
How to convert list to string [duplicate],"806
votes",python string list
pg_config executable not found,"805
votes",python pip psycopg2
Remove all whitespace in a string,"804
votes",python trim removing-whitespace
What __init__ and self do on Python?,"804
votes",python oop self
How do I unload (reload) a Python module?,"803
votes",python module reload python-import
Get unique values from a list in python [duplicate],"801
votes",python
How to print the full traceback without halting the program?,"798
votes",python exception-handling
python setup.py uninstall,"792
votes",python setup.py pypi
How to properly ignore exceptions,"785
votes",python exception try-except
Using Python 3 in virtualenv,"784
votes",python python-3.x virtualenv
How do you test that a Python function throws an exception?,"784
votes",python unit-testing exception exception-handling
Convert a String representation of a Dictionary to a dictionary?,"781
votes",python string dictionary
How to remove the first Item from a list?,"781
votes",python arrays list
What is the naming convention in Python for variable and function names?,"780
votes",python variables function naming-conventions
Shuffling a list of objects,"778
votes",python list random shuffle
How do you remove duplicates from a list whilst preserving order?,"778
votes",python list duplicates unique
Convert hex string to int in Python,"778
votes",python string hex
Usage of __slots__?,"775
votes",python oop python-internals slots
How to check if type of a variable is string?,"774
votes",python string variables types
How to subtract a day from a date?,"773
votes",python datetime date
How to drop rows of Pandas DataFrame whose value in a certain column is NaN,"771
votes",python pandas dataframe nan
Is there any way to kill a Thread?,"771
votes",python multithreading kill terminate
How can I check file size in Python?,"770
votes",python file
How to retrieve a module's path?,"769
votes",python module inotify
How to print number with commas as thousands separators?,"768
votes",python number-formatting
What is the purpose and use of **kwargs?,"768
votes",python kwargs
Maximum and Minimum values for ints,"766
votes",python integer
Import a module from a relative path,"763
votes",python relative-path python-import
Python `if x is not None` or `if not x is None`?,"761
votes",python coding-style nonetype boolean-expression pep8
"What are the differences between the urllib, urllib2, urllib3 and requests module?","759
votes",python python-requests urllib2 urllib python-2.x
How to get a function name as a string?,"758
votes",python string function
How to overcome “datetime.datetime not JSON serializable”?,"757
votes",python json
Get the data received in a Flask request,"757
votes",python flask werkzeug
Converting from a string to boolean in Python?,"755
votes",python string boolean
How to use a decimal range() step value?,"752
votes",python floating-point range
How to fix “Attempted relative import in non-package” even with __init__.py,"749
votes",python package python-import importerror init
Relative imports in Python 2.7,"749
votes",python python-2.7 import relative-path
How to print an exception in Python?,"748
votes",python exception error-handling
How to use glob() to find files recursively?,"748
votes",python path filesystems glob fnmatch
How to change a string into uppercase,"743
votes",python string uppercase
List comprehension vs map,"741
votes",python list-comprehension map-function
Relative imports in Python 3,"739
votes",python python-3.x python-import
What is the difference between pip and conda?,"738
votes",python pip ipython package-managers conda
How to define a two-dimensional array in Python,"735
votes",python matrix syntax-error
What is the best project structure for a Python application? [closed],"732
votes",python directory-structure organization project-structure
How to get an absolute file path in Python,"731
votes",python path relative-path absolute-path
Using @property versus getters and setters,"731
votes",python properties getter-setter
"What is a clean, pythonic way to have multiple constructors in Python?","728
votes",python constructor
Is arr.__len__() the preferred way to get the length of an array in Python?,"728
votes",python arrays methods
Find which version of package is installed with pip,"727
votes",python pip
Writing a pandas DataFrame to CSV file,"725
votes",python csv pandas dataframe
What is the difference between range and xrange functions in Python 2.X?,"724
votes",python loops range python-2.x xrange
How can I force division to be floating point? Division keeps rounding down to 0?,"721
votes",python floating-point integer division python-2.x
Single quotes vs. double quotes in Python [closed],"718
votes",python coding-style
Use a list of values to select rows from a pandas dataframe [duplicate],"716
votes",python pandas dataframe
Traverse a list in reverse order in Python,"715
votes",python loops reverse
How can I make a Python script standalone executable to run without ANY dependency?,"713
votes",python executable
Why is [] faster than list()?,"712
votes",python performance list instantiation literals
About catching ANY exception,"709
votes",python exception-handling
What is the difference between dict.items() and dict.iteritems() in Python2?,"709
votes",python dictionary python-2.x
not None test in Python [duplicate],"708
votes",python nonetype
Running unittest with typical test directory structure,"707
votes",python unit-testing
How do I remove packages installed with Python's easy_install?,"704
votes",python packages setuptools easy-install
"What is __future__ in Python used for and how/when to use it, and how it works","703
votes",python python-2.x
How do I change the working directory in Python?,"702
votes",python cd
pip install from git repo branch,"698
votes",python git pip
How do I detect whether a Python variable is a function?,"696
votes",python
