question,votes,tags
Create empty file using python [duplicate],"262
votes",python
Actual meaning of 'shell=True' in subprocess,"262
votes",python subprocess
JSONDecodeError: Expecting value: line 1 column 1 (char 0),"262
votes",python json api curl
How do I clone a Django model instance object and save it to the database?,"261
votes",python django django-models
"What blocks Ruby, Python to get Javascript V8 speed? [closed]","261
votes",javascript python ruby performance language-design
Get loop count inside a Python FOR loop,"261
votes",python for-loop
How to find which version of TensorFlow is installed in my system?,"261
votes",python ubuntu tensorflow command-line version
Sending HTML email using Python,"261
votes",python email html-email
How do I update Anaconda?,"261
votes",python anaconda conda
How to send POST request?,"261
votes",python urllib httplib
Writing string to a file on a new line every time,"261
votes",python newline
How to properly determine current script directory?,"261
votes",python pythonpath dirname
Python read a single character from the user,"261
votes",python input
How can I read inputs as numbers?,"261
votes",python python-3.x python-2.7 input int
How do I parallelize a simple Python loop?,"261
votes",python parallel-processing
Running single test from unittest.TestCase via command line,"260
votes",python unit-testing python-unittest
How to print the value of a Tensor object in TensorFlow?,"260
votes",python tensorflow tensor
How to convert 'binary string' to normal string in Python3?,"260
votes",python string python-3.x binary
How do I find an element that contains specific text in Selenium Webdriver (Python)?,"260
votes",python selenium selenium-webdriver
Named colors in matplotlib,"259
votes",python matplotlib colors
Can Flask have optional URL parameters?,"259
votes",python flask
How to convert a PIL Image into a numpy array?,"259
votes",python image numpy python-imaging-library numpy-ndarray
How to use MySQLdb with Python and Django in OSX 10.6?,"259
votes",python mysql django virtualenv virtualenvwrapper
Is there a way to detach matplotlib plots so that the computation can continue?,"259
votes",python matplotlib plot
What does `ValueError: cannot reindex from a duplicate axis` mean?,"259
votes",python pandas
Pandas index column title or name,"258
votes",python pandas dataframe columnname
Using logging in multiple modules,"258
votes",python logging config
Cross-platform way of getting temp directory in Python,"258
votes",python cross-platform temporary-directory
What's the best way to generate a UML diagram from Python source code? [closed],"258
votes",python uml diagram
Using both Python 2.x and Python 3.x in IPython Notebook,"257
votes",python python-2.7 python-3.x ipython ipython-notebook
Failed to install Python Cryptography package with PIP and setup.py,"257
votes",python cryptography pip
Python's most efficient way to choose longest string in list?,"257
votes",python list list-comprehension
How to round to 2 decimals with Python?,"257
votes",python rounding
How to sort a dataFrame in python pandas by two or more columns?,"257
votes",python pandas python-2.7 sorting data-analysis
How to retry after exception?,"256
votes",python loops exception try-except
Simplify Chained Comparison,"256
votes",python pycharm
"In Python, if I return inside a “with” block, will the file still close?","256
votes",python return with-statement
What's the best solution for OpenID with Django? [closed],"256
votes",python django openid
Remove rows with duplicate indices (Pandas DataFrame and TimeSeries),"255
votes",python pandas
Reverse colormap in matplotlib,"255
votes",python matplotlib
"DatabaseError: current transaction is aborted, commands ignored until end of transaction block?","255
votes",python django postgresql psycopg2
"What are the differences between Perl, Python, AWK and sed? [closed]","254
votes",python perl sed awk language-comparisons
Matplotlib scatter plot with different text at each data point,"254
votes",python matplotlib text scatter-plot annotate
"Comparing two NumPy arrays for equality, element-wise","254
votes",python arrays numpy elementwise-operations
Django gives Bad Request (400) when DEBUG = False,"254
votes",python django
Relationship between SciPy and NumPy,"254
votes",python numpy scipy
How to initialize a dict with keys from a list and empty value in Python?,"253
votes",dictionary python
"When I catch an exception, how do I get the type, file, and line number?","253
votes",python exception stack-trace traceback
correct way to define class variables in Python [duplicate],"253
votes",python class attributes
NumPy array is not JSON serializable,"252
votes",python json django numpy
How to check if a value exists in a dictionary (python),"252
votes",python dictionary find
Why doesn't Python have multiline comments?,"252
votes",python comments multiline
What's the best way to parse command line arguments? [closed],"251
votes",python command-line command-line-arguments
How to check if a user is logged in (how to properly use user.is_authenticated)?,"251
votes",python django authentication
How to truncate the time on a DateTime object in Python?,"251
votes",python datetime
Python != operation vs “is not”,"251
votes",python operators
What are type hints in Python 3.5?,"251
votes",python python-3.x python-3.5 type-hinting
How to find the installed pandas version,"251
votes",python pandas
Python truncate a long string,"250
votes",python
How do I filter query objects by date range in Django?,"250
votes",python django django-models django-queryset
Why aren't python nested functions called closures?,"250
votes",python closures nested-function
Relative paths in Python,"250
votes",python relative-path path
What is the purpose of class methods?,"250
votes",python class-method
Should I use “camel case” or underscores in python? [duplicate],"250
votes",python naming-conventions pep8
How to execute a Python script from the Django shell?,"249
votes",python django django-shell
How do I put a variable inside a string?,"249
votes",python string variables
A weighted version of random.choice,"249
votes",python optimization
How can I find the current OS in Python? [duplicate],"249
votes",python cross-platform platform-specific
Url decode UTF-8 in Python,"249
votes",python encoding utf-8 urldecode
"In Python, how do you convert seconds since epoch to a `datetime` object?","249
votes",python datetime date time epoch
How to calculate the angle between a line and the horizontal axis?,"249
votes",c# python trigonometry
What do (lambda) function closures capture?,"249
votes",python lambda closures
Compare object instances for equality by their attributes,"249
votes",python equality
"Comparing two dictionaries and checking how many (key, value) pairs are equal","248
votes",python dictionary comparison
How do I loop through a list by twos? [duplicate],"248
votes",python list loops for-loop iteration
Is generator.next() visible in Python 3?,"248
votes",python python-3.x iteration
Convert Pandas Column to DateTime,"248
votes",python datetime pandas
Is False == 0 and True == 1 an implementation detail or is it guaranteed by the language?,"248
votes",python boolean equality language-specifications
Find string between two substrings [duplicate],"247
votes",string python substring
Get the Row(s) which have the max count in groups using groupby,"247
votes",python pandas max pandas-groupby
Get a random boolean in python?,"247
votes",python random
Python Anaconda - How to Safely Uninstall,"247
votes",python anaconda
Django: Display Choice Value,"247
votes",python django django-models django-templates
Python multiprocessing PicklingError: Can't pickle <type 'function'>,"247
votes",python multiprocessing pickle python-multiprocessing
Python try…except comma vs 'as' in except,"247
votes",python python-2.6
"What's the proper way to install pip, virtualenv, and distribute for Python?","247
votes",python virtualenv setuptools distribute
"In Python, how do I convert all of the items in a list to floats?","246
votes",python
Element-wise addition of 2 lists?,"246
votes",python list elementwise-operations
How to use `subprocess` command with pipes,"246
votes",python linux subprocess pipe
Python call function within class,"246
votes",python class function call
How to implement the Softmax function in Python,"246
votes",python numpy machine-learning logistic-regression softmax
Having Django serve downloadable files,"246
votes",python django django-authentication
What is the global interpreter lock (GIL) in CPython?,"246
votes",python python-internals gil
numpy: most efficient frequency counts for unique values in an array,"245
votes",python arrays performance numpy
remove None value from a list without removing the 0 value,"245
votes",python list filter nonetype
How do you create a daemon in Python?,"245
votes",python daemon
Concatenating two lists - difference between '+=' and extend(),"245
votes",list python
"Using pickle.dump - TypeError: must be str, not bytes","245
votes",python python-3.x pickle
Replace non-ASCII characters with a single space,"245
votes",python unicode encoding ascii
You need to install postgresql-server-dev-X.Y for building a server-side extension or libpq-dev for building a client-side application,"244
votes",python django postgresql
Extracting text from HTML file using Python,"244
votes",python html text html-content-extraction
"Convert a timedelta to days, hours and minutes","244
votes",python timedelta
Mapping over values in a python dictionary,"244
votes",python dictionary map-function
What's the difference between dist-packages and site-packages?,"244
votes",python pip easy-install package-managers
no acceptable C compiler found in $PATH when installing python,"243
votes",python compiler-errors virtualenv
Read file from line 2 or skip header row,"243
votes",python file-io
Transpose list of lists,"243
votes",python list transpose
How to dump a dict to a json file?,"243
votes",python json dictionary
Creating an empty list in Python,"243
votes",python performance list coding-style timeit
Pandas: drop a level from a multi-level column index?,"243
votes",python pandas
Bare asterisk in function arguments?,"243
votes",python python-3.x parameter-passing
Add list to set?,"242
votes",python list set
Python JSON serialize a Decimal object,"242
votes",python json floating-point decimal
"Class method differences in Python: bound, unbound and static","242
votes",python
What is the result of % in Python?,"242
votes",python python-2.7 syntax operators modulo
Set variable in jinja [duplicate],"242
votes",python templates variables variable-assignment jinja2
Python: Removing \xa0 from string?,"242
votes",python parsing unicode
How to unzip a list of tuples into individual lists? [duplicate],"242
votes",python list tuples list-comprehension
Broken references in Virtualenvs,"242
votes",python macos virtualenv homebrew dyld
How to implement common bash idioms in Python? [closed],"242
votes",python bash shell
how to sort pandas dataframe from one column,"242
votes",python pandas sorting
Why doesn't Python have a sign function?,"242
votes",python language-design
What is the difference between ndarray and array in numpy?,"242
votes",python arrays numpy multidimensional-array numpy-ndarray
Reusable library to get human readable version of file size?,"241
votes",python code-snippets filesize
Convert sqlalchemy row object to python dict,"241
votes",python sqlalchemy
Abstract methods in Python [duplicate],"241
votes",python inheritance abstract
Microsoft Visual C++ 14.0 is required (Unable to find vcvarsall.bat),"241
votes",python python-3.x visual-c++
Django set default form values,"241
votes",python django django-models django-forms
Why compile Python code?,"241
votes",python compilation
"How can I read large text files in Python, line by line, without loading it into memory?","241
votes",python
Why does Python's hash of infinity have the digits of π?,"241
votes",python math hash floating-point pi
"Remove all special characters, punctuation and spaces from string","240
votes",python regex string
Defining private module functions in python,"240
votes",python function module private
How do you extract a column from a multi-dimensional array?,"240
votes",python arrays multidimensional-array extraction
How to sum all the values in a dictionary?,"240
votes",python dictionary hash sum
how to concatenate two dictionaries to create a new one in Python? [duplicate],"240
votes",python dictionary concatenation
All combinations of a list of lists,"240
votes",python combinations
python .replace() regex [duplicate],"240
votes",python regex
Pandas read in table without headers,"240
votes",python pandas
Better way to shuffle two numpy arrays in unison,"239
votes",python numpy random shuffle numpy-ndarray
Python not working in the command line of git bash,"239
votes",python windows git command-line git-bash
Getting the exception value in Python,"239
votes",python exception
Daemon Threads Explanation,"239
votes",python multithreading daemon python-multithreading
Initializing a list to a known number of elements in Python [duplicate],"239
votes",python arrays list
Why isn't my Pandas 'apply' function referencing multiple columns working? [closed],"239
votes",python python-2.7 pandas dataframe apply
Converting numpy dtypes to native python types,"239
votes",python numpy
How should I log while using multiprocessing in Python?,"239
votes",python logging multiprocessing
How can I check for Python version in a program that uses new language features?,"239
votes",python version
How can I format a decimal to always show 2 decimal places?,"238
votes",python string-formatting
Matplotlib different size subplots,"238
votes",python plot matplotlib figure
How do I keep Python print from adding newlines or spaces? [duplicate],"238
votes",python printing formatting python-2.x
What's the correct way to convert bytes to a hex string in Python 3?,"238
votes",python python-3.x hex
SQLAlchemy IN clause,"238
votes",python sqlalchemy
NumPy array initialization (fill with identical values),"238
votes",python arrays numpy
matplotlib Legend Markers Only Once,"238
votes",python matplotlib
"Django - what is the difference between render(), render_to_response() and direct_to_template()?","238
votes",python django
How to count the frequency of the elements in an unordered list?,"237
votes",python counter frequency counting
"Matplotlib 2 Subplots, 1 Colorbar","237
votes",python matplotlib subplot colorbar
How to activate virtualenv?,"237
votes",python linux virtualenv
Getting rid of \n when using .readlines() [duplicate],"237
votes",python python-2.7 readline
How do I compare version numbers in Python?,"237
votes",python version string-comparison
How to get method parameter names?,"237
votes",python decorator introspection python-datamodel
SSL InsecurePlatform error when using Requests package,"237
votes",python ssl python-requests
How to get only the last part of a path in Python?,"237
votes",python path path-manipulation
How to check whether a variable is a class or not?,"237
votes",python reflection
How to use a variable inside a regular expression?,"237
votes",python regex python-3.x variables escaping
Adding default parameter value with type hint in Python,"237
votes",python python-3.x type-hinting
How to crop an image in OpenCV using Python,"236
votes",python opencv
Formatting “yesterday's” date in python,"236
votes",python datetime date
How do you generate dynamic (parameterized) unit tests in python?,"236
votes",python unit-testing parameterized-unit-test
Is Python strongly typed?,"236
votes",python strong-typing weak-typing
Saving an Object (Data persistence),"236
votes",python object serialization save pickle
Getting command-line password input in Python,"236
votes",python command-line passwords
Plot two histograms on single chart with matplotlib,"235
votes",python matplotlib plot histogram
How to sort a list of lists by a specific index of the inner list?,"235
votes",python sorting
How to select rows with one or more nulls from a pandas DataFrame without listing columns explicitly?,"235
votes",python pandas null nan
Selecting with complex criteria from pandas.DataFrame,"235
votes",python pandas
Counting the Number of keywords in a dictionary in python,"235
votes",python dictionary count keyword
Why does PEP-8 specify a maximum line length of 79 characters? [closed],"235
votes",python coding-style pep8
read subprocess stdout line by line,"235
votes",python subprocess
Cannot install Lxml on Mac os x 10.9,"234
votes",python xcode macos scrapy lxml
Test if a variable is a list or tuple,"234
votes",python types list
Length of an integer in Python,"234
votes",python count integer
How do I update a Python package?,"234
votes",python packages
Why does “pip install” inside Python raise a SyntaxError?,"234
votes",python pip installation
Django template how to look up a dictionary value with a variable,"234
votes",python django templates dictionary
How to pip install a package with min and max version range?,"234
votes",python pip multiple-versions
How to load/edit/run/save text files (.py) into an IPython notebook cell?,"234
votes",python jupyter-notebook ipython jupyter
Access multiple elements of list knowing their index,"234
votes",python python-3.x list indexing element
PATH issue with pytest 'ImportError: No module named YadaYadaYada',"233
votes",python unit-testing pytest
"CSV in Python adding an extra carriage return, on Windows","233
votes",python windows csv newline
Multiple constructors in python? [duplicate],"233
votes",python constructor
How do I plot in real-time in a while loop using matplotlib?,"233
votes",python matplotlib while-loop real-time
_csv.Error: field larger than field limit (131072),"233
votes",python csv
What's the u prefix in a Python string?,"233
votes",python syntax
Python list subtraction operation,"232
votes",python list
How do I install Python OpenCV through Conda?,"232
votes",python opencv anaconda conda
pip install - locale.Error: unsupported locale setting,"232
votes",python python-3.x centos pip
pandas get rows which are NOT in other dataframe,"232
votes",python pandas dataframe
Round number to nearest integer,"232
votes",python
Display image as grayscale using matplotlib,"232
votes",python matplotlib grayscale
Normalize columns of pandas data frame,"231
votes",python pandas dataframe normalize
Get month name from number,"231
votes",python datetime date
What do I use for a max-heap implementation in Python?,"231
votes",python data-structures heap recursive-datastructures
Redirecting to URL in Flask,"231
votes",python redirect flask
python: How do I know what type of exception occurred?,"231
votes",python exception
what is the right way to treat Python argparse.Namespace() as a dictionary?,"231
votes",python dictionary duck-typing
How can I obtain the element-wise logical NOT of a pandas Series?,"231
votes",python pandas boolean-logic
How do I profile memory usage in Python?,"231
votes",python memory profiling
How do I disable the security certificate check in Python requests,"230
votes",python https python-requests
multiple prints on the same line in Python,"230
votes",python printing stdout line-breaks
Convert floats to ints in Pandas?,"230
votes",python pandas floating-point integer dataset
How to install both Python 2.x and Python 3.x in Windows,"230
votes",python windows compatibility backwards-compatibility build-environment
How to get a complete list of object's methods and attributes?,"230
votes",python
Convert array of indices to 1-hot encoded numpy array,"229
votes",python numpy machine-learning numpy-ndarray one-hot-encoding
How to get a string after a specific substring?,"229
votes",python string
How often does python flush to a file?,"229
votes",python file flush
Argparse: Required arguments listed under “optional arguments”?,"229
votes",python argparse
Generate 'n' unique random numbers within a range [duplicate],"229
votes",python random unique
Escaping regex string,"229
votes",python regex
How do I convert a numpy array to (and display) an image?,"228
votes",python arrays image numpy data-visualization
List files ONLY in the current directory,"228
votes",python
How do I filter ForeignKey choices in a Django ModelForm?,"228
votes",python django django-forms
Display help message with python argparse when script is called without any arguments,"228
votes",python argparse
"In Python, how do I split a string and keep the separators?","228
votes",python regex
How to change plot background color?,"228
votes",python matplotlib
Double Iteration in List Comprehension,"227
votes",python list-comprehension
Initialise a list to a specific length in Python [duplicate],"227
votes",python list
Cron and virtualenv,"227
votes",python django cron virtualenv
How to override the [] operator in Python?,"227
votes",python operator-overloading
Running Python on Windows for Node.js dependencies,"226
votes",python windows node.js npm
"In Python, how do you convert a `datetime` object to seconds?","226
votes",python python-2.7
How to count the number of files in a directory using Python,"226
votes",python count glob fnmatch
How can I mock requests and the response?,"226
votes",python mocking request
Writing Unicode text to a text file?,"226
votes",python unicode character-encoding python-2.x
Configuring so that pip install can work from github,"226
votes",python git pip
Typical AngularJS workflow and project structure (with Python Flask),"226
votes",javascript python flask angularjs
How do I change the figure size for a seaborn plot?,"225
votes",python seaborn
Are tuples more efficient than lists in Python?,"225
votes",python performance list tuples python-internals
Python recursive folder read,"225
votes",python scripting file-io
Removing Conda environment,"225
votes",python jupyter conda
How to add title to subplots in Matplotlib?,"225
votes",python matplotlib plot subtitle
"Using Python's os.path, how do I go up one directory?","225
votes",python django
“inconsistent use of tabs and spaces in indentation”,"225
votes",python
How do Python's any and all functions work?,"225
votes",python
How to find all the subclasses of a class given its name?,"225
votes",python subclass
bs4.FeatureNotFound: Couldn't find a tree builder with the features you requested: lxml. Do you need to install a parser library?,"225
votes",python python-2.7 beautifulsoup lxml
ValueError: The truth value of an array with more than one element is ambiguous. Use a.any() or a.all(),"225
votes",python numpy
socket.error: [Errno 48] Address already in use,"224
votes",python macos simplehttpserver
How to check if one of the following items is in a list?,"224
votes",python
How to use Xpath in Python?,"224
votes",python xml dom xpath python-2.x
"How do I get the object if it exists, or None if it does not exist?","223
votes",python django django-queryset
How to run Conda?,"223
votes",python bash anaconda conda
Get IP address of visitors using Flask for Python,"223
votes",python flask ip-address werkzeug
Removing nan values from an array,"223
votes",python arrays numpy nan
Making a request to a RESTful API using python,"223
votes",python api rest elasticsearch
How do I create a Python function with optional arguments?,"223
votes",python function arguments optional-arguments
Python integer division yields float,"223
votes",python integer python-3.x division
Moving matplotlib legend outside of the axis makes it cutoff by the figure box,"223
votes",python matplotlib legend
Check if string ends with one of the strings from a list,"222
votes",python string list
Find object in list that has attribute equal to some value (that meets any condition),"222
votes",python django list
Unpack a list in Python?,"222
votes",python list argument-passing
"A clean, lightweight alternative to Python's twisted? [closed]","222
votes",python networking twisted asynchronous
Extracting just Month and Year separately from Pandas Datetime column,"221
votes",python pandas
How do I replace whitespaces with underscore and vice versa?,"221
votes",python regex django
Count unique values with pandas per groups [duplicate],"221
votes",python pandas group-by unique pandas-groupby
Programmatically generate video or animated GIF in Python?,"221
votes",python video wxpython animated-gif
Apply multiple functions to multiple groupby columns,"221
votes",python group-by aggregate-functions pandas
"builtins.TypeError: must be str, not bytes","221
votes",python python-3.x lxml
How to make good reproducible pandas examples,"221
votes",python pandas
Get column index from column name in python pandas,"221
votes",python pandas dataframe indexing
input() error - NameError: name '…' is not defined,"221
votes",python python-2.7 input nameerror
Is there any way to do HTTP PUT in python,"220
votes",python http put
List comprehension on a nested list?,"220
votes",python list nested list-comprehension
dropping infinite values from dataframes in pandas?,"220
votes",python numpy scipy pandas
Convert string date to timestamp in Python,"220
votes",python datetime
Django Template Variables and Javascript,"220
votes",javascript python django google-app-engine django-templates
"How to set a single, main title above all the subplots with Pyplot?","220
votes",python matplotlib
Check if string contains only whitespace,"220
votes",python text whitespace
How to install python modules without root access?,"220
votes",python numpy pip
How to determine the encoding of text?,"220
votes",python encoding text-files
Why am I seeing “TypeError: string indices must be integers”?,"220
votes",python json github
Simpler way to create dictionary of separate variables?,"220
votes",python string variables
"In pytest, what is the use of conftest.py files?","220
votes",python testing pytest
What will happen if I modify a Python script while it's running?,"220
votes",python
