question,votes,tags
How to get all possible combinations of a list’s elements?,"431
votes",python combinations
Python string.replace regular expression [duplicate],"431
votes",python regex replace
"What's the difference between eval, exec, and compile?","431
votes",python dynamic eval exec
Alphabet range in Python,"430
votes",python string list alphabet
Can I get JSON to load into an OrderedDict?,"430
votes",python json load ordereddictionary
Python's time.clock() vs. time.time() accuracy?,"430
votes",python time
Understanding dict.copy() - shallow or deep?,"429
votes",python dictionary copy
"Get exception description and stack trace which caused an exception, all as a string","429
votes",python python-2.7 exception-handling stack-trace
How to disable python warnings,"428
votes",python suppress-warnings
"What is the maximum recursion depth in Python, and how to increase it?","428
votes",python recursion
SQLAlchemy: What's the difference between flush() and commit()?,"428
votes",python sqlalchemy
SQLAlchemy ORDER BY DESCENDING?,"427
votes",python sqlalchemy
Why do some functions have underscores “__” before and after the function name?,"427
votes",python function methods double-underscore
Correct way to try/except using Python requests module?,"426
votes",python request python-requests
What is a Python equivalent of PHP's var_dump()? [duplicate],"426
votes",php python debugging
Pretty printing XML in Python,"425
votes",python xml pretty-print
What does -1 mean in numpy reshape?,"425
votes",python numpy reshape numpy-ndarray
Elegant ways to support equivalence (“equality”) in Python classes,"423
votes",python equality equivalence
How do I specify that the return type of a method is the same as the class itself?,"423
votes",python python-3.x pycharm typing python-3.5
How do I determine if my python shell is executing in 32bit or 64bit mode on OS X?,"422
votes",python macos
Difference between __getattr__ vs __getattribute__,"422
votes",python getattr getattribute
How do I read CSV data into a record array in NumPy?,"421
votes",python numpy scipy genfromtxt
UnicodeDecodeError when reading CSV file in Pandas with Python,"421
votes",python pandas csv dataframe unicode
Working with UTF-8 encoding in Python source [duplicate],"421
votes",python encoding utf-8 character-encoding
Filter dataframe rows if value in column is in a set list of values [duplicate],"421
votes",python pandas dataframe
How to get a random number between a float range?,"421
votes",python random floating-point
How to list all functions in a Python module?,"420
votes",python reflection module inspect
What is the reason for having '//' in Python? [duplicate],"420
votes",python division
What is the python “with” statement designed for?,"420
votes",python language-features with-statement
bash: pip: command not found,"418
votes",python macos pip python-2.6
Convert JSON string to dict using Python,"418
votes",python json string
How to sort a list of strings?,"418
votes",python string sorting
How to save a Python interactive session?,"417
votes",python shell read-eval-print-loop interactive-session
How to avoid Python/Pandas creating an index in a saved csv?,"417
votes",python csv indexing pandas
Expanding tuples into arguments,"416
votes",python tuples parameter-passing
Convert a list of characters into a string,"416
votes",python string
Python datetime to string without microsecond component,"415
votes",python datetime datetime-format
How do you get a query string on Flask?,"415
votes",python flask query-string
Use 'import module' or 'from module import'?,"415
votes",python python-import
Sort a list of tuples by 2nd item (integer value) [duplicate],"414
votes",python list tuples
Generator Expressions vs. List Comprehension,"414
votes",python list-comprehension generator
Determine if variable is defined in Python [duplicate],"412
votes",python variables defined
Get name of current script in Python,"412
votes",python scripting basename
How can I get the source code of a Python function?,"411
votes",python function
Decorators with parameters?,"410
votes",python decorator
Difference between exit() and sys.exit() in Python,"410
votes",python exit
Determine Whether Integer Is Between Two Other Integers?,"408
votes",python
Import multiple csv files into pandas and concatenate into one DataFrame,"408
votes",python pandas csv dataframe concatenation
"In practice, what are the main uses for the new “yield from” syntax in Python 3.3?","408
votes",python yield
How can I see normal print output created during pytest run?,"408
votes",python logging output pytest
Python: Checking if a 'Dictionary' is empty doesn't seem to work,"407
votes",python dictionary
Rename a dictionary key,"407
votes",python dictionary associative-array ordereddictionary
Rename multiple files in a directory in Python [duplicate],"406
votes",python file-io file-rename
Find full path of the Python interpreter?,"406
votes",python path
No module named MySQLdb,"405
votes",python django python-2.x
How to find out if a Python object is a string?,"404
votes",python string types compatibility
Should import statements always be at the top of a module?,"404
votes",python optimization coding-style
Download large file in python with requests,"403
votes",python download stream python-requests
pip install fails with “connection error: [SSL: CERTIFICATE_VERIFY_FAILED] certificate verify failed (_ssl.c:598)”,"402
votes",python windows ssl pip
How to re import an updated package while in Python Interpreter? [duplicate],"402
votes",python
Find all packages installed with easy_install/pip?,"401
votes",python pip easy-install pypi
How to “test” NoneType in python?,"401
votes",python nonetype
Selecting a row of pandas series/dataframe by integer index,"401
votes",python pandas dataframe indexing
Python: How to ignore an exception and proceed? [duplicate],"400
votes",python exception
Is there a “not equal” operator in Python?,"398
votes",python operators
Multiple variables in a 'with' statement?,"397
votes",python with-statement
Get all object attributes in Python? [duplicate],"397
votes",python introspection python-2.6
How do I calculate the date six months from the current date using the datetime Python module?,"396
votes",python datetime
Is there a simple way to remove multiple spaces in a string?,"395
votes",python regex string
Check if all elements in a list are identical,"395
votes",python algorithm comparison
What is `related_name` used for in Django?,"395
votes",python django many-to-many foreign-key-relationship
Flattening a shallow list in Python [duplicate],"394
votes",python list-comprehension
How to use the pass statement?,"393
votes",python
JSON datetime between Python and JavaScript,"393
votes",javascript python json
Split string every nth character?,"392
votes",python string split
What does “SyntaxError: Missing parentheses in call to 'print'” mean in Python?,"392
votes",python python-3.x
How to find elements by class,"391
votes",python html web-scraping beautifulsoup
Get the last 4 characters of a string [duplicate],"391
votes",python string
How can I explicitly free memory in Python?,"391
votes",python memory memory-management
How to define two fields “unique” as couple,"391
votes",python django django-models
"PyLint, PyChecker or PyFlakes? [closed]","391
votes",python pylint pep8 pyflakes pychecker
Reimport a module in python while interactive,"390
votes",python
How to declare and add items to an array in Python?,"389
votes",python arrays
"return, return None, and no return at all?","389
votes",python null return
Changing one character in a string,"388
votes",python string
Check if multiple strings exist in another string,"388
votes",python arrays string exists
How do I remove a substring from the end of a string in Python?,"388
votes",python string
Read .mat files in Python,"387
votes",python matlab file-io scipy mat-file
Python Dictionary Comprehension,"386
votes",python dictionary list-comprehension
How do I get the path of the Python script I am running in? [duplicate],"385
votes",python path
Python module for converting PDF to text [closed],"385
votes",python pdf text-extraction pdf-scraping
How can I compare two lists in python and return matches,"384
votes",python list
How to compare two dates?,"384
votes",python datetime
How to detect a Christmas Tree? [closed],"382
votes",c++ python opencv image-processing computer-vision
What are the differences between json and simplejson Python modules?,"382
votes",python json simplejson
How to count the occurrence of certain item in an ndarray in Python?,"381
votes",python numpy multidimensional-array count
How to write inline if statement for print?,"380
votes",python if-statement inline
How can I use pickle to save a dict?,"380
votes",python dictionary pickle
How to find all occurrences of an element in a list?,"380
votes",python list
What is memoization and how can I use it in Python?,"380
votes",python memoization
Simple Digit Recognition OCR in OpenCV-Python,"380
votes",python opencv numpy computer-vision ocr
The difference between sys.stdout.write and print?,"380
votes",python printing stdout
Creating a range of dates in Python,"379
votes",python datetime date
When is del useful in python?,"379
votes",python dictionary python-internals del
How to invoke the super constructor in Python?,"379
votes",python class inheritance constructor superclass
Reading binary file and looping over each byte,"379
votes",python file-io binary
How to read a file without newlines?,"379
votes",python line-breaks readlines
Pandas Merging 101,"379
votes",python pandas join merge
Remove all occurrences of a value from a list?,"378
votes",python list
"Truth value of a Series is ambiguous. Use a.empty, a.bool(), a.item(), a.any() or a.all()","378
votes",python pandas dataframe boolean filtering
Python List vs. Array - when to use?,"378
votes",python arrays list
Unresolved reference issue in PyCharm,"377
votes",python ide pycharm
How to write a Python module/package?,"377
votes",python python-2.7 python-module
Sorting list based on values from another list?,"377
votes",python list sorting
What does it mean if a Python object is “subscriptable” or not?,"377
votes",python terminology
Append values to a set in Python,"376
votes",python set append
"Constructing pandas DataFrame from values in variables gives “ValueError: If using all scalar values, you must pass an index”","375
votes",python pandas dataframe scalar
Python unittest - opposite of assertRaises?,"375
votes",python unit-testing
Iterating through a range of dates in Python,"374
votes",python datetime iteration
Hiding axis text in matplotlib plots,"374
votes",python matplotlib plot
Can a website detect when you are using selenium with chromedriver?,"374
votes",javascript python google-chrome selenium selenium-chromedriver
Change the name of a key in dictionary,"373
votes",python dictionary sequence
Plot logarithmic axes with matplotlib in python,"373
votes",python matplotlib scale logarithm
Adding 5 days to a date in Python,"373
votes",python date datetime
How to apply a function to two columns of Pandas dataframe,"373
votes",python pandas dataframe
What is the standard way to add N seconds to datetime.time in Python?,"373
votes",python datetime time math
How to download image using requests,"372
votes",python urllib2 python-requests
Remove all the elements that occur in one list from another,"372
votes",python list
Does reading an entire file leave the file handle open?,"372
votes",python file-io filehandle
How can I check the syntax of Python script without executing it?,"372
votes",python compilation syntax-checking
Numpy array dimensions,"372
votes",python arrays numpy dimensions
Printing Lists as Tabular Data,"371
votes",python
How can I get the named parameters from a URL using Flask?,"371
votes",python web-services flask url-parameters
"How to add to the PYTHONPATH in Windows, so it finds my modules/packages?","371
votes",python windows environment-variables pythonpath
Sum a list of numbers in Python,"371
votes",python list sum
How do I disable log messages from the Requests library?,"370
votes",python logging python-requests verbosity
How do I create a variable number of variables?,"370
votes",python variable-variables
time.sleep — sleeps thread or process?,"370
votes",python multithreading time sleep python-internals
How to find all occurrences of a substring?,"367
votes",python regex string
How to rename a file using Python,"367
votes",python file-rename
Explaining Python's '__enter__' and '__exit__',"367
votes",python oop with-statement
Print a list in reverse order with range()?,"366
votes",python
What's the difference between `raw_input()` and `input()` in Python 3?,"365
votes",python python-3.x input
How can I selectively escape percent (%) in Python strings?,"365
votes",python escaping python-2.7
Reloading submodules in IPython,"365
votes",python ipython
How to pivot a dataframe,"365
votes",python pandas group-by pivot pandas-groupby
Run function from the command line,"364
votes",python function command-line
How do I access command line arguments in Python?,"364
votes",python command-line
Is there a way to perform “if” in python's lambda,"363
votes",python lambda python-2.6
Python - Create list with numbers between 2 values?,"363
votes",python list
How can I convert a datetime object to milliseconds since epoch (unix time) in Python?,"361
votes",python datetime epoch
Which is the preferred way to concatenate a string in Python?,"361
votes",python string python-3.x concat
How do I execute a string containing Python code in Python?,"360
votes",python string exec
How to empty a list?,"359
votes",python list
What is an alternative to execfile in Python 3?,"359
votes",python python-3.x
Fastest way to list all primes below N,"359
votes",python math optimization primes
How do I find the time difference between two datetime objects in python?,"358
votes",python datetime date-arithmetic
Python Requests throwing SSLError,"357
votes",python ssl python-requests urllib3
logger configuration to log to file and print to stdout,"357
votes",python file logging stdout
Circular (or cyclic) imports in Python,"357
votes",python circular-dependency cyclic-reference
What does on_delete do on Django models?,"356
votes",python django django-models
Implement touch using Python?,"356
votes",python utility
Comprehensive beginner's virtualenv tutorial? [closed],"356
votes",python virtualenv
How to get a value from a cell of a dataframe?,"355
votes",python pandas dataframe
Find index of last occurrence of a substring in a string,"355
votes",python string
How can I color Python logging output?,"355
votes",python logging colors
Python Graph Library [closed],"355
votes",python graph
How do I find out my python path using python?,"354
votes",python python-module pythonpath
What are the differences between numpy arrays and matrices? Which one should I use?,"354
votes",python arrays matrix numpy
How can I tell if a string repeats itself in Python?,"353
votes",python string pattern-matching
How to use timeit module,"353
votes",python time timeit
How do I increase the cell width of the Jupyter/ipython notebook in my browser?,"352
votes",python ipython ipython-notebook jupyter-notebook jupyter
Installing PIL with pip,"352
votes",python python-2.7 installation pip python-imaging-library
How do I get a Cron like scheduler in Python?,"352
votes",python cron scheduled-tasks
"What is logits, softmax and softmax_cross_entropy_with_logits?","352
votes",python machine-learning tensorflow
Is it possible to use pip to install a package from a private GitHub repository?,"352
votes",python git github pip
How do I get the parent directory in Python?,"351
votes",python
Python Pandas Error tokenizing data,"351
votes",python csv pandas
Generating an MD5 checksum of a file,"351
votes",python md5 checksum hashlib
Converting dictionary to JSON,"351
votes",python json python-2.7 dictionary
How do you express binary literals in Python?,"351
votes",python syntax binary integer literals
Threading pool similar to the multiprocessing Pool?,"350
votes",python multithreading missing-features
How do I install the yaml package for Python?,"349
votes",python python-2.7 yaml pip pyyaml
Split by comma and strip whitespace in Python,"349
votes",python whitespace strip
Suppress InsecureRequestWarning: Unverified HTTPS request is being made in Python2.6,"348
votes",python python-2.6 suppress-warnings urllib3 pyvmomi
Why is python setup.py saying invalid command 'bdist_wheel' on Travis CI?,"348
votes",python travis-ci setup.py pypi
How to get the return value from a thread in python?,"348
votes",python multithreading
Can a variable number of arguments be passed to a function?,"348
votes",python
Python dictionary from an object's fields,"348
votes",python dictionary attributes object metaprogramming
Is there a standardized method to swap two variables in Python?,"348
votes",python syntax swap conventions
ISO time (ISO 8601) in Python,"347
votes",python datetime iso8601
Installing Python packages from local file system folder to virtualenv with pip,"347
votes",python pip
Passing a dictionary to a function as keyword parameters,"347
votes",python function dictionary parameters keyword
Automatically creating directories with file output [duplicate],"347
votes",python file-io
Python argparse command line flags without arguments,"347
votes",python command-line-arguments argparse
Python date string to date object,"346
votes",python date
Deep copy of a dict in python,"346
votes",python python-3.x
Most efficient way to map function over numpy array,"345
votes",python performance numpy
What's the pythonic way to use getters and setters?,"344
votes",python getter-setter
Is there a Python equivalent to Ruby's string interpolation?,"344
votes",python string-interpolation language-comparisons
How to uninstall Python 2.7 on a Mac OS X 10.6.4?,"343
votes",python macos uninstallation python-2.7
Stripping everything but alphanumeric chars from a string in Python,"343
votes",python string
Append a dictionary to a dictionary [duplicate],"343
votes",python dictionary
How can I get list of values from dict?,"343
votes",python list dictionary
Setting the correct encoding when piping stdout in Python,"343
votes",python encoding terminal stdout python-2.x
Python argparse: How to insert newline in the help text?,"343
votes",python argparse
Python nonlocal statement,"342
votes",python closures global python-nonlocal
ValueError: invalid literal for int() with base 10: '',"342
votes",python
How to extract the substring between two markers?,"341
votes",python string substring
Measuring elapsed time with the Time module,"341
votes",python time elapsed
How to reset index in a pandas dataframe? [duplicate],"341
votes",python indexing pandas dataframe
How to get week number in Python?,"341
votes",python datetime week-number
Why is there no tuple comprehension in Python?,"341
votes",python tuples list-comprehension dictionary-comprehension set-comprehension
how to check if a file is a directory or regular file in python? [duplicate],"340
votes",python
Showing the stack trace from a running Python application,"340
votes",python debugging stack-trace traceback
Python setup.py develop vs install,"340
votes",python setuptools
No Multiline Lambda in Python: Why not?,"339
votes",python syntax lambda
How to get current CPU and RAM usage in Python?,"339
votes",python system cpu status ram
Sorting arrays in NumPy by column,"338
votes",python arrays sorting numpy scipy
'pip' is not recognized as an internal or external command,"338
votes",python django windows pip
How do I get list of methods in a Python class?,"338
votes",python
Python String and Integer concatenation [duplicate],"338
votes",python string integer concatenation
List attributes of an object,"337
votes",python class python-3.x
setup script exited with error: command 'x86_64-linux-gnu-gcc' failed with exit status 1,"336
votes",python gcc pip odoo-server
Python list sort in descending order,"336
votes",python sorting reverse
Getting today's date in YYYY-MM-DD in Python?,"336
votes",python datetime python-datetime
Find nearest value in numpy array,"336
votes",python search numpy
How to pretty-print a numpy.array without scientific notation and with given precision?,"336
votes",python numpy python-2.x pretty-print
What are some common uses for Python decorators? [closed],"336
votes",python decorator
Download file from web in Python 3,"335
votes",python python-3.x
Case insensitive regular expression without re.compile?,"335
votes",python regex case-sensitive case-insensitive
"super() raises “TypeError: must be type, not classobj” for new-style class","335
votes",python superclass super typeerror
"What SOAP client libraries exist for Python, and where is the documentation for them? [closed]","335
votes",python soap soap-client
Where does pip install its packages?,"334
votes",python django pip virtualenv
How to get POSTed JSON in Flask?,"334
votes",python json post flask
How to query as GROUP BY in django?,"334
votes",python django django-models
What is the best way to compare floats for almost-equality in Python?,"334
votes",python floating-point
Elegant Python function to convert CamelCase to snake_case?,"333
votes",python camelcasing
What's the best practice using a settings file in Python? [closed],"333
votes",python parsing configuration yaml settings
join list of lists in python [duplicate],"332
votes",python
How to set Python's default version to 3.x on OS X?,"332
votes",python python-3.x macos installation
pandas: filter rows of DataFrame with operator chaining,"332
votes",python pandas dataframe
Unicode (UTF-8) reading and writing to files in Python,"331
votes",python unicode utf-8 io
Substitute multiple whitespace with single whitespace in Python [duplicate],"331
votes",python substitution removing-whitespace
Pandas read_csv low_memory and dtype options,"331
votes",python parsing numpy pandas dataframe
Does Python support short-circuiting?,"331
votes",python boolean-logic short-circuiting
How do I create test and train samples from one dataframe with pandas?,"330
votes",python python-2.7 pandas dataframe
What is the most efficient way to loop through dataframes with pandas? [duplicate],"330
votes",python pandas performance dataframe for-loop
Pandas - How to flatten a hierarchical index in columns,"330
votes",python pandas dataframe
InsecurePlatformWarning: A true SSLContext object is not available. This prevents urllib3 from configuring SSL appropriately [duplicate],"330
votes",python rest ssl
Installing pip packages to $HOME folder,"330
votes",python pip
Fixed digits after decimal with f-strings,"329
votes",python python-3.x f-string
What is the difference between “ is None ” and “ ==None ”,"329
votes",python jython
How to overload __init__ method based on argument type?,"328
votes",python constructor operator-overloading
How to clear the interpreter console?,"327
votes",python windows console
Why is “except: pass” a bad programming practice?,"327
votes",python exception error-handling try-catch
What does enumerate() mean?,"327
votes",python enumerate
Get the cartesian product of a series of lists?,"327
votes",python list cartesian-product
Converting Python dict to kwargs?,"327
votes",python dictionary kwargs
beyond top level package error in relative import,"327
votes",python import package
Python 3 ImportError: No module named 'ConfigParser',"326
votes",python python-3.x
Permanently add a directory to PYTHONPATH?,"326
votes",python windows pythonpath
Using module 'subprocess' with timeout,"326
votes",python multithreading timeout subprocess
"'too many values to unpack', iterating over a dict. key=>string, value=>list","326
votes",python
What is __main__.py?,"326
votes",python
“pip install unroll”: “python setup.py egg_info” failed with error code 1,"326
votes",python pip package installation
How to change legend size with matplotlib.pyplot,"325
votes",python size matplotlib legend
Why doesn't os.path.join() work in this case?,"325
votes",python path
How can I check if a key exists in a dictionary? [duplicate],"325
votes",python
defaultdict of defaultdict?,"325
votes",python collections
How do I watch a file for changes?,"325
votes",python file pywin32 watch
Is it possible to make abstract classes in Python?,"324
votes",python class inheritance abstract-class abstract
How to format a floating number to fixed width in Python,"324
votes",python string numbers number-formatting
"Run a Python script from another Python script, passing in arguments [duplicate]","324
votes",python
Why isn't Python very good for functional programming? [closed],"324
votes",python functional-programming
Best ways to teach a beginner to program? [closed],"324
votes",python language-agnostic
Remap values in pandas column with a dict,"323
votes",python dictionary pandas remap
Else clause on Python while statement,"323
votes",python syntax while-loop if-statement
Reading JSON from a file?,"322
votes",python json
Extract subset of key-value pairs from Python dictionary object?,"322
votes",python dictionary associative-array
"Difference between numpy.array shape (R, 1) and (R,)","322
votes",python numpy matrix multidimensional-array
Get lengths of a list in a jinja2 template,"322
votes",python jinja2
Pandas conditional creation of a series/dataframe column,"321
votes",python pandas numpy dataframe
"pandas create new column based on values from other columns / apply a function of multiple columns, row-wise","321
votes",python pandas numpy apply
How to store a dataframe using Pandas,"321
votes",python pandas dataframe
How to keep keys/values in same order as declared?,"321
votes",python sorting dictionary
What is the difference between an expression and a statement in Python?,"321
votes",python expression
